{
  "schema_version": 1,
  "evidence_type": "oak-jre-provenance",
  "subject": {
    "distribution": "Temurin",
    "implementor_version": "Temurin-21.0.11+10",
    "java_version": "21.0.11",
    "target": {
      "platform": "win32",
      "arch": "x64"
    },
    "runtime_root": "tools/jre-win32-x64",
    "runtime_manifest": "tools/jre-win32-x64/manifest.json",
    "runtime_lock": "config/tool-manifests/jre-win32-x64.json"
  },
  "official_release": {
    "publisher": "Eclipse Adoptium",
    "release_page_url": "https://github.com/adoptium/temurin21-binaries/releases/tag/jdk-21.0.11%2B10",
    "release_api_url": "https://api.github.com/repos/adoptium/temurin21-binaries/releases/tags/jdk-21.0.11%2B10",
    "release_api_sha256": "6b76c193d01b76ef0d558ee79bf2df459bb79cfe281d37a380a5fa714207d61f",
    "tag": "jdk-21.0.11+10",
    "published_at": "2026-04-23T06:32:33Z",
    "artifact": {
      "url": "https://github.com/adoptium/temurin21-binaries/releases/download/jdk-21.0.11%2B10/OpenJDK21U-jdk_x64_windows_hotspot_21.0.11_10.zip",
      "filename": "OpenJDK21U-jdk_x64_windows_hotspot_21.0.11_10.zip",
      "size_bytes": 205073954,
      "sha256": "d3625e7cadf23787ea540229544b6e2ab494b3b54da1801879e583e1dfee0a64",
      "github_server_digest": "sha256:d3625e7cadf23787ea540229544b6e2ab494b3b54da1801879e583e1dfee0a64"
    },
    "checksum": {
      "url": "https://github.com/adoptium/temurin21-binaries/releases/download/jdk-21.0.11%2B10/OpenJDK21U-jdk_x64_windows_hotspot_21.0.11_10.zip.sha256.txt",
      "size_bytes": 116,
      "sha256": "f17855dbb78f9d208f9a42c166c7300e3f7d091e8048f4068bacf58b41feb9cd",
      "declared_artifact_sha256": "d3625e7cadf23787ea540229544b6e2ab494b3b54da1801879e583e1dfee0a64",
      "filename_matches": true
    },
    "build_metadata": {
      "url": "https://github.com/adoptium/temurin21-binaries/releases/download/jdk-21.0.11%2B10/OpenJDK21U-jdk_x64_windows_hotspot_21.0.11_10.zip.json",
      "size_bytes": 32557,
      "sha256": "863216215e34a4218b8616fad24f7aa18636cec93ffccc62f17b1dcc663c9b8a",
      "artifact_digest_matches": true,
      "vendor": "Eclipse Adoptium",
      "os": "windows",
      "arch": "x64",
      "binary_type": "jdk",
      "version": "21.0.11+10-LTS",
      "scm_ref": "jdk-21.0.11+10_adopt",
      "build_ref": "https://github.com/adoptium/temurin-build/commit/a612825ee82a20ac872d60958c349854c1f29a8e",
      "openjdk_source": "https://github.com/adoptium/jdk21u/commit/254494ad7d75b37f1c033245fb4dbd460d0347b5"
    },
    "gpg": {
      "signature_url": "https://github.com/adoptium/temurin21-binaries/releases/download/jdk-21.0.11%2B10/OpenJDK21U-jdk_x64_windows_hotspot_21.0.11_10.zip.sig",
      "signature_size_bytes": 310,
      "signature_sha256": "01892e4bf7cedba5b587a155af2a9d9513870bdc25156e47f328b50e4017af43",
      "public_key_url": "https://packages.adoptium.net/artifactory/api/gpg/key/public",
      "public_key_sha256": "a46d5d3ab75c3c86dddf1bfd2957a067a24b1c6b2d2ed2bc69294bf970c5160b",
      "verification_status": "not_verified_no_openpgp_tool"
    }
  },
  "derivation": {
    "official_jdk_file_count": 490,
    "installed_jdk_file_count": 490,
    "byte_identical_jdk_file_count": 490,
    "official_jdk_total_bytes": 343822457,
    "installed_jdk_total_bytes": 343822457,
    "official_jdk_tree_sha256": "613c12718b72625393d84c35b4f09886e7e67addcb401a0b1949902eb05d8932",
    "installed_jdk_tree_sha256": "613c12718b72625393d84c35b4f09886e7e67addcb401a0b1949902eb05d8932",
    "module_policy": "fixed-conservative-java-se",
    "requested_modules": [
      "java.se",
      "jdk.unsupported",
      "jdk.xml.dom"
    ],
    "jlink_options": [
      "--module-path",
      "<source-jdk>/jmods",
      "--add-modules",
      "java.se,jdk.unsupported,jdk.xml.dom",
      "--output",
      "<staging-output>",
      "--strip-debug",
      "--no-header-files",
      "--no-man-pages",
      "--compress=2"
    ],
    "runtime_file_count": 207,
    "runtime_total_bytes": 52384264,
    "runtime_tree_sha256": "16efd16ec81ed492a6c3c285f313456ec216099fb87000c1e607973c9e99210e",
    "runtime_manifest_sha256": "d0622d252094e387879713ef2497c917eec431e3d15287a826e7ccc6b8ce218d",
    "preserved_official_material_count": 94,
    "generated_files": [
      "SOURCE_JDK_RELEASE.txt",
      "THIRD_PARTY_NOTICES.md"
    ]
  },
  "redistribution": {
    "license_summary": "GPLv2 with Classpath Exception; OpenJDK Assembly Exception and bundled third-party notices",
    "notice_path": "NOTICE",
    "legal_root": "legal/",
    "source_release_path": "SOURCE_JDK_RELEASE.txt",
    "generated_notice_path": "THIRD_PARTY_NOTICES.md",
    "official_materials_preserved": true,
    "human_signoff_required": true
  },
  "verification": {
    "machine_status": "verified",
    "human_review_status": "pending",
    "observed_at": "2026-07-28",
    "limitations": [
      "The detached signature and Adoptium public key were captured and hashed, but OpenPGP verification was not performed because no verifier is installed.",
      "The official ZIP, installed JDK and generated jlink runtime are byte-bound, but this is not an independent reproducible-build audit of Adoptium's source build.",
      "License, trademark, source-offer and third-party redistribution obligations still require named human sign-off before sale."
    ]
  },
  "official_jdk_files": [
    {
      "path": "NOTICE",
      "size_bytes": 2400,
      "sha256": "c02756bcd9fa8191bf0fda4451bc018414dd44ee35bf09922c24377a475e4b5a"
    },
    {
      "path": "bin/api-ms-win-core-console-l1-1-0.dll",
      "size_bytes": 22072,
      "sha256": "88ace577a9c51061cb7d1a36babbbefa48212fadc838ffde98fdfff60de18386"
    },
    {
      "path": "bin/api-ms-win-core-console-l1-2-0.dll",
      "size_bytes": 22056,
      "sha256": "c062477ad3bfdc57b0cc402179637a214dab5045c8d644592c7decca7d18aa50"
    },
    {
      "path": "bin/api-ms-win-core-datetime-l1-1-0.dll",
      "size_bytes": 22056,
      "sha256": "1bd81dfd19204b44662510d9054852fb77c9f25c1088d647881c9b976cc16818"
    },
    {
      "path": "bin/api-ms-win-core-debug-l1-1-0.dll",
      "size_bytes": 21944,
      "sha256": "591358eb4d1531e9563ee0813e4301c552ce364c912ce684d16576eabf195dc3"
    },
    {
      "path": "bin/api-ms-win-core-errorhandling-l1-1-0.dll",
      "size_bytes": 22096,
      "sha256": "d56ce7b1cd76108ad6c137326ec694a14c99d48c3d7b0ace8c3ff4d9bcee3ce8"
    },
    {
      "path": "bin/api-ms-win-core-fibers-l1-1-0.dll",
      "size_bytes": 22072,
      "sha256": "91d249d7bc0e38ef6bcb17158b1fdc6dd8888dc086615c9b8b750b87e52a5fb3"
    },
    {
      "path": "bin/api-ms-win-core-fibers-l1-1-1.dll",
      "size_bytes": 22072,
      "sha256": "fc9d86cec621383eab636ebc87ddd3f5c19a3cb2a33d97be112c051d0b275429"
    },
    {
      "path": "bin/api-ms-win-core-file-l1-1-0.dll",
      "size_bytes": 26152,
      "sha256": "1ca895aba4e7435563a6b43e85eba67a0f8c74aa6a6a94d0fc48fa35535e2585"
    },
    {
      "path": "bin/api-ms-win-core-file-l1-2-0.dll",
      "size_bytes": 22056,
      "sha256": "4cadbc0c39da7c6722206fdcebd670abe5b8d261e7b041dd94f9397a89d1990d"
    },
    {
      "path": "bin/api-ms-win-core-file-l2-1-0.dll",
      "size_bytes": 21960,
      "sha256": "93c624b366ba16c643fc8933070a26f03b073ad0cf7f80173266d67536c61989"
    },
    {
      "path": "bin/api-ms-win-core-handle-l1-1-0.dll",
      "size_bytes": 21944,
      "sha256": "39095f59c41d76ec81bb2723d646fde4c148e7cc3402f4980d2ade95cb9c84f9"
    },
    {
      "path": "bin/api-ms-win-core-heap-l1-1-0.dll",
      "size_bytes": 22072,
      "sha256": "8f105771b236dbcb859de271f0a6822ce1cb79c36988dd42c9e3f6f55c5f7eb9"
    },
    {
      "path": "bin/api-ms-win-core-interlocked-l1-1-0.dll",
      "size_bytes": 22072,
      "sha256": "53b25e753ca785bf8b695d89dde5818a318890211dc992a89146f16658f0b606"
    },
    {
      "path": "bin/api-ms-win-core-kernel32-legacy-l1-1-1.dll",
      "size_bytes": 22080,
      "sha256": "a9b13a1cd1b8c19b0c6b4afcd5bb0dd29c0e2288231ac9e6db8510094ce68ba6"
    },
    {
      "path": "bin/api-ms-win-core-libraryloader-l1-1-0.dll",
      "size_bytes": 22056,
      "sha256": "7f39ba298b41e4963047341288cab36b6a241835ee11ba4ad70f44dacd40906c"
    },
    {
      "path": "bin/api-ms-win-core-localization-l1-2-0.dll",
      "size_bytes": 22080,
      "sha256": "6ee44dd0d8510dc024c9f7c79b1b9fa88c987b26b6beb6653ddd11751c34e5dc"
    },
    {
      "path": "bin/api-ms-win-core-memory-l1-1-0.dll",
      "size_bytes": 22056,
      "sha256": "0512a35316ec9180437f86696a84c5c06a7e4e82e050055a656e5bf9fca206f9"
    },
    {
      "path": "bin/api-ms-win-core-namedpipe-l1-1-0.dll",
      "size_bytes": 22096,
      "sha256": "c05f1fffe3b5a2738ea54ce9485cca026fb9635f982626fba1e1dcc531897273"
    },
    {
      "path": "bin/api-ms-win-core-processenvironment-l1-1-0.dll",
      "size_bytes": 21968,
      "sha256": "c4eca98c3c67b6395d5b005b00ac1eb0318b86b23aa71035a44c2b1602befba9"
    },
    {
      "path": "bin/api-ms-win-core-processthreads-l1-1-0.dll",
      "size_bytes": 22096,
      "sha256": "5ccb89e93d67bc3288d4e84649c5346e66e15e3d7cd65d989daf3f4cb584be9a"
    },
    {
      "path": "bin/api-ms-win-core-processthreads-l1-1-1.dll",
      "size_bytes": 22072,
      "sha256": "4ad565a8ba3ef0ea8ab87221ad11f83ee0bc844ce236607958406663b407333e"
    },
    {
      "path": "bin/api-ms-win-core-profile-l1-1-0.dll",
      "size_bytes": 22080,
      "sha256": "7809160932f44e59b021699f5bc68799eb7293ee1fa926d6fcca3c3445302e61"
    },
    {
      "path": "bin/api-ms-win-core-rtlsupport-l1-1-0.dll",
      "size_bytes": 21960,
      "sha256": "9dc1e91e71c7c054854bd1487cb4e6946d82c9f463430f1c4e8d1471005172b1"
    },
    {
      "path": "bin/api-ms-win-core-string-l1-1-0.dll",
      "size_bytes": 22056,
      "sha256": "60fc31d2a0c634412f529dba76af3b9bf991352877c6dae528186d3935704cfd"
    },
    {
      "path": "bin/api-ms-win-core-synch-l1-1-0.dll",
      "size_bytes": 22056,